{
  "schema_version": 1,
  "attempt_id": "att-T19-0022",
  "kind": "original",
  "parent_attempt": null,
  "finding_id": null,
  "case": {
    "repository": "testcases",
    "path": "sql/_36_guava/cbrd_26659/cases/cbrd_26659_oos_rep06_lob_neighbours.sql",
    "name": "cbrd_26659_oos_rep06_lob_neighbours"
  },
  "requirements": [
    "OOS-REP-06",
    "OOS-SQL-01",
    "OOS-SQL-05"
  ],
  "manifest_id": "inv-T19-0003",
  "configuration": {
    "page_size": 16384,
    "build_mode": "release",
    "run_mode": "client-server",
    "instrumentation_id": null,
    "seed": null
  },
  "started_at": "2026-09-15T16:51:10+09:00",
  "ended_at": "2026-09-15T16:53:12+09:00",
  "deadline": {
    "seconds": 120,
    "reached": false,
    "evidence_captured_on_timeout": null
  },
  "outcome": "FAIL",
  "skip_reason": null,
  "assertions": {
    "executed": null,
    "failed": null
  },
  "expected_versus_actual": "/home/vimkim/.cub/campaign/cbrd-26659/ticket19/attempts/inv-T19-0003/expected_vs_actual_cbrd_26659_oos_rep06_lob_neighbours.diff",
  "oos_evidence": {
    "status": "proven",
    "channel": "show-heap-oos",
    "reference": "cbrd-26659/campaign/evidence/ticket19/inv-T19-0003/activation_cbrd_26659_oos_rep06_lob_neighbours_release.txt",
    "applicability": null
  },
  "barriers": [],
  "injections": [],
  "resources_owned": {
    "databases": [
      "basic (CTP-created under the campaign-private CUBRID_DATABASES /home/vimkim/.cub/campaign/cbrd-26659/ticket19/ctpdb)",
      "t19lob (paired activation checker)"
    ],
    "processes": [
      "cub_master port 26659",
      "cub_server basic",
      "broker BROKER1 port 33120"
    ],
    "ports": [
      26659,
      33120,
      33122
    ],
    "directories": [
      "/home/vimkim/.cub/campaign/cbrd-26659/ticket19"
    ]
  },
  "cleanup": {
    "performed": true,
    "scope_verified": true,
    "evidence_preserved_first": true,
    "evidence": "Namespace: campaign_ns.sh. The whole invocation ran under campaign_ns.sh (unshare --user --map-current-user --pid --fork --mount-proc --ipc), so CTP's unscoped `pkill cub` and ipcrm sweep could reach only processes and segments this invocation started; the launcher's exit tore the namespace down. Install hygiene by hashing before and after: conf drift 0, databases drift 0, testcase worktree drift 0 (None = not measured by this bundle's producer). All launcher artifacts were copied into the bundle before the install and worktree were restored."
  },
  "bundle": {
    "path": "/home/vimkim/.cub/campaign/cbrd-26659/ticket19/attempts/inv-T19-0003",
    "hash": "sha256:9f6d2dcf252c2c1e89e3072aee08bc0d482d7faebfbbede4f754091687cf82df"
  },
  "reproduction": {
    "fresh_fixture": true,
    "consecutive_reproductions_so_far": 0,
    "failure_reproduced": false
  },
  "notes": "original attempt of cbrd_26659_oos_rep06_lob_neighbours, CTP SQL runner, release build, client-server, 16384 B pages. CTP listed the case in nokList with totalTime 74 ms; expected-versus-actual MISMATCH. assertions.executed is null because the CTP SQL runner has no assertion counter (ticket 35 F3); OOS-path evidence: activation proven by the paired checker in the case's own run mode (client-server), same fixture, same install, same page size. BUNDLE HASH CORRECTED by ticket 44 F3 on 2026-09-16: the recorded digest sha256:422ffeb437881b14eac3fe16d2c6a715f3af4f49806bdb2f4802db55d311acc5 is replaced by the finished bundle's sha256:9f6d2dcf252c2c1e89e3072aee08bc0d482d7faebfbbede4f754091687cf82df; and the replay-bundle index's total_bytes 385125 is replaced by 422786. Both were taken while this invocation's shared bundle directory was still being written, so they described no bundle that ever existed on disk. The bundle is unchanged and was not re-hashed silently: the new digest is the sha256 of the SHA256SUMS the bundle carries, which `sha256sum -c` verifies, and the new size is the sum of the files it lists. One bundle per invocation, referenced by its attempt records, is the contract the user settled on 2026-09-16 (ticket 44 F3)."
}
