{
  "schema_version": 1,
  "attempt_id": "att-T18-0062",
  "kind": "original",
  "parent_attempt": null,
  "finding_id": null,
  "case": {
    "repository": "testcases",
    "path": "sql/_36_guava/cbrd_26659/cases/cbrd_26659_oos_rep09_null_empty.sql",
    "name": "cbrd_26659_oos_rep09_null_empty"
  },
  "requirements": [
    "OOS-REP-09"
  ],
  "manifest_id": "inv-T18-0004",
  "configuration": {
    "page_size": 16384,
    "build_mode": "debug",
    "run_mode": "client-server",
    "instrumentation_id": null,
    "seed": null
  },
  "started_at": "2026-09-21T16:12:34+09:00",
  "ended_at": "2026-09-21T16:17:14+09:00",
  "deadline": {
    "seconds": 120,
    "reached": false,
    "evidence_captured_on_timeout": null
  },
  "outcome": "PASS",
  "skip_reason": null,
  "assertions": {
    "executed": null,
    "failed": null
  },
  "expected_versus_actual": "/home/vimkim/.cub/campaign/cbrd-26659/ticket18/attempts/inv-T18-0004/expected_vs_actual_cbrd_26659_oos_rep09_null_empty.diff",
  "oos_evidence": {
    "status": "proven",
    "channel": "show-heap-oos",
    "reference": "cbrd-26659/campaign/evidence/ticket18/inv-T18-0004/activation_cbrd_26659_oos_rep09_null_empty_debug.txt",
    "applicability": null
  },
  "barriers": [],
  "injections": [],
  "resources_owned": {
    "databases": [
      "basic (CTP-created under the campaign-private CUBRID_DATABASES /home/vimkim/.cub/campaign/cbrd-26659/ticket18/ctpdb)",
      "t18rep09 (paired activation checker)"
    ],
    "processes": [
      "cub_master port 26659",
      "cub_server basic",
      "broker BROKER1 port 33120"
    ],
    "ports": [
      26659,
      33120,
      33122
    ],
    "directories": [
      "/home/vimkim/.cub/campaign/cbrd-26659/ticket18"
    ]
  },
  "cleanup": {
    "performed": true,
    "scope_verified": true,
    "evidence_preserved_first": true,
    "evidence": "Namespace: campaign_ns.sh. The whole invocation ran under campaign_ns.sh (unshare --user --map-current-user --pid --fork --mount-proc --ipc), so CTP's unscoped `pkill cub` and ipcrm sweep could reach only processes and segments this invocation started; the launcher's exit tore the namespace down. Install hygiene by hashing before and after: conf drift 0, databases drift 0, testcase worktree drift 0 (None = not measured by this bundle's producer). All launcher artifacts were copied into the bundle before the install and worktree were restored."
  },
  "bundle": {
    "path": "/home/vimkim/.cub/campaign/cbrd-26659/ticket18/attempts/inv-T18-0004",
    "hash": "sha256:48223ac07dbccc218a8fb3d4fb1a0da098e8096548325533f038df6f7790f8c6"
  },
  "reproduction": {
    "fresh_fixture": true,
    "consecutive_reproductions_so_far": 0,
    "failure_reproduced": false
  },
  "notes": "original attempt of cbrd_26659_oos_rep09_null_empty, CTP SQL runner, debug build, client-server, 16384 B pages. CTP listed the case in okList with totalTime 213 ms; expected-versus-actual MATCH. assertions.executed is null because the CTP SQL runner has no assertion counter (ticket 35 F3); OOS-path evidence: activation proven by the paired checker in the case's own run mode (client-server), same fixture, same install, same page size. "
}
