{
  "schema_version": 1,
  "attempt_id": "att-T19-C002",
  "kind": "checker-validation",
  "parent_attempt": null,
  "finding_id": null,
  "case": {
    "repository": "testcases",
    "path": "sql/_36_guava/cbrd_26659/cases/cbrd_26659_oos_sql02_mixed_chunks.sql",
    "name": "cbrd_26659_oos_sql02_mixed_chunks"
  },
  "requirements": [
    "OOS-SQL-01",
    "OOS-SQL-02"
  ],
  "manifest_id": "none: checker-validation attempts have no manifest and no matrix row (schemas document section 11)",
  "configuration": {
    "page_size": 16384,
    "build_mode": "release",
    "run_mode": "client-server",
    "instrumentation_id": null,
    "seed": null
  },
  "started_at": "2026-09-15T17:28:48+09:00",
  "ended_at": "2026-09-15T17:29:37+09:00",
  "deadline": {
    "seconds": 120,
    "reached": false,
    "evidence_captured_on_timeout": null
  },
  "outcome": "FAIL",
  "skip_reason": null,
  "assertions": {
    "executed": null,
    "failed": null
  },
  "expected_versus_actual": "/home/vimkim/.cub/campaign/cbrd-26659/ticket19/attempts/inv-T19-C002/expected_vs_actual.diff",
  "oos_evidence": {
    "status": "missing",
    "channel": "show-heap-oos",
    "reference": null,
    "applicability": null
  },
  "barriers": [],
  "injections": [],
  "resources_owned": {
    "databases": [
      "basic (CTP-created under the campaign-private CUBRID_DATABASES /home/vimkim/.cub/campaign/cbrd-26659/ticket19/ctpdb)",
      "t19ctl1 (paired activation checker)"
    ],
    "processes": [
      "cub_master port 26659",
      "cub_server basic",
      "broker BROKER1 port 33120"
    ],
    "ports": [
      26659,
      33120,
      33122
    ],
    "directories": [
      "/home/vimkim/.cub/campaign/cbrd-26659/ticket19"
    ]
  },
  "cleanup": {
    "performed": true,
    "scope_verified": true,
    "evidence_preserved_first": true,
    "evidence": "Namespace: campaign_ns.sh. The whole invocation ran under campaign_ns.sh (unshare --user --map-current-user --pid --fork --mount-proc --ipc), so CTP's unscoped `pkill cub` and ipcrm sweep could reach only processes and segments this invocation started; the launcher's exit tore the namespace down. Install hygiene by hashing before and after: conf drift 0, databases drift 0, testcase worktree drift 0 (None = not measured by this bundle's producer). All launcher artifacts were copied into the bundle before the install and worktree were restored."
  },
  "bundle": {
    "path": "/home/vimkim/.cub/campaign/cbrd-26659/ticket19/attempts/inv-T19-C002",
    "hash": "sha256:65a9f04527cdefedad6cc2cb950b71e240d9e4cc9951b9fd2e8c5908f35a9b65"
  },
  "reproduction": {
    "fresh_fixture": true,
    "consecutive_reproductions_so_far": 0,
    "failure_reproduced": false
  },
  "notes": "checker-validation attempt of cbrd_26659_oos_sql02_mixed_chunks, CTP SQL runner, release build, client-server, 16384 B pages. CTP listed the case in nokList with totalTime 64 ms; expected-versus-actual MISMATCH. assertions.executed is null because the CTP SQL runner has no assertion counter (ticket 35 F3); OOS-path evidence: the activation checker did NOT prove activation (RESULT: activation NOT proven -- 1 assertion(s) failed.); not OOS coverage. "
}
